{
  "schema_version": "1.0",
  "message_id": "tv-nq-es-strikes-MNQ-trigger-s2-sell-QQQ-5-1792680000000",
  "sent_at": "2026-10-22T14:40:02.480Z",
  "source": {
    "type": "tradingview",
    "name": "nq-es-strikes",
    "version": "4.0"
  },
  "signal_type": "trigger",
  "action": "sell",
  "instrument": {
    "symbol": "MNQ"
  },
  "quantity": 1,
  "details": {
    "setup": "Setup 2"
  }
}
