{
  "schema_version": "1.0",
  "message_id": "tv-MNQ-trigger-s3-reverse_short-QQQ-5-1792684000000",
  "sent_at": "2026-10-22T15:46:40.250Z",
  "source": {
    "type": "tradingview",
    "name": "nq-es-strikes",
    "version": "4.0"
  },
  "signal_type": "trigger",
  "action": "reverse",
  "side": "short",
  "instrument": {
    "symbol": "MNQ"
  },
  "quantity": 1
}
