{
  "schema_version": "1.0",
  "message_id": "tv-MNQ-tradeplan-1792681200000",
  "sent_at": "2026-10-22T15:00:00.120Z",
  "source": {
    "type": "tradingview",
    "name": "strikes-quanticocap",
    "version": "3.2"
  },
  "signal_type": "trade_plan",
  "action": "sell",
  "instrument": {
    "symbol": "MNQ"
  },
  "quantity": 2,
  "reference_price": "21012.5"
}
